{"base_commit":"base-1","commit":"candidate-1","duration_ms":1,"exit_code":0,"protected_paths":[],"protection":"unprotected","repo":"local://example/repository","resource_protection":"none","resource_set_digest":null,"resources":[],"signal":null,"stderr":{"eof":true,"observed_bytes":0,"payload_digest":"sha256:e3b0c44298fc1c149afbf4c8996fb92427ae41e4649b934ca495991b7852b855","size":0,"storage_ref":"local://sha256/e3b0c44298fc1c149afbf4c8996fb92427ae41e4649b934ca495991b7852b855","tail_base64":"","truncated":false},"stdout":{"eof":false,"observed_bytes":2,"payload_digest":"sha256:2689367b205c16ce32ed4200942b8b8b1e262dfc70d9bc9fbc77c49699a4f1df","size":2,"storage_ref":"local://sha256/2689367b205c16ce32ed4200942b8b8b1e262dfc70d9bc9fbc77c49699a4f1df","tail_base64":"b2s=","truncated":true},"stop_reason":"completed","termination":"none"}