{"base_commit":"base-1","commit":"candidate-1","duration_ms":1,"exit_code":1,"protected_paths":[],"protection":"unprotected","repo":"local://example/repository","resource_protection":"none","resource_set_digest":null,"resources":[],"signal":null,"stderr":{"eof":true,"observed_bytes":7,"payload_digest":"sha256:6da5b18878e110928643ebcc38dbb7552cf3a296eea56493e23edc2b93eecff8","size":7,"storage_ref":"local://sha256/6da5b18878e110928643ebcc38dbb7552cf3a296eea56493e23edc2b93eecff8","tail_base64":"ZmFpbGVkCg==","truncated":false},"stdout":{"eof":true,"observed_bytes":0,"payload_digest":"sha256:e3b0c44298fc1c149afbf4c8996fb92427ae41e4649b934ca495991b7852b855","size":0,"storage_ref":"local://sha256/e3b0c44298fc1c149afbf4c8996fb92427ae41e4649b934ca495991b7852b855","tail_base64":"","truncated":false},"stop_reason":"completed","termination":"none"}