{"base_commit":"base-1","commit":"candidate-1","duration_ms":1,"exit_code":-9,"protected_paths":[],"protection":"unprotected","repo":"local://example/repository","resource_protection":"none","resource_set_digest":null,"resources":[],"signal":9,"stderr":{"eof":true,"observed_bytes":0,"payload_digest":"sha256:e3b0c44298fc1c149afbf4c8996fb92427ae41e4649b934ca495991b7852b855","size":0,"storage_ref":"local://sha256/e3b0c44298fc1c149afbf4c8996fb92427ae41e4649b934ca495991b7852b855","tail_base64":"","truncated":false},"stdout":{"eof":true,"observed_bytes":0,"payload_digest":"sha256:e3b0c44298fc1c149afbf4c8996fb92427ae41e4649b934ca495991b7852b855","size":0,"storage_ref":"local://sha256/e3b0c44298fc1c149afbf4c8996fb92427ae41e4649b934ca495991b7852b855","tail_base64":"","truncated":false},"stop_reason":"deadline","termination":"killed_after_grace"}