{"base_commit":"base-1","commit":"candidate-1","duration_ms":1,"exit_code":0,"protected_paths":[],"protection":"unprotected","repo":"local://example/repository","resource_protection":"protected","resource_set_digest":"sha256:ac238bb1de5db1d8c8cee691626af721119ffc241431f22603ce77c22af1e305","resources":[{"executable":true,"name":"bin/run \"ñ\".sh","sha256":"sha256:e3b0c44298fc1c149afbf4c8996fb92427ae41e4649b934ca495991b7852b855","size":0},{"executable":false,"name":"select_best.py","sha256":"sha256:62bdb208de6dc6b169a467f646f50ca39e6c203fa6f6732431624d8dec1e77fb","size":11}],"signal":null,"stderr":{"eof":true,"observed_bytes":0,"payload_digest":"sha256:e3b0c44298fc1c149afbf4c8996fb92427ae41e4649b934ca495991b7852b855","size":0,"storage_ref":"local://sha256/e3b0c44298fc1c149afbf4c8996fb92427ae41e4649b934ca495991b7852b855","tail_base64":"","truncated":false},"stdout":{"eof":true,"observed_bytes":0,"payload_digest":"sha256:e3b0c44298fc1c149afbf4c8996fb92427ae41e4649b934ca495991b7852b855","size":0,"storage_ref":"local://sha256/e3b0c44298fc1c149afbf4c8996fb92427ae41e4649b934ca495991b7852b855","tail_base64":"","truncated":false},"stop_reason":"completed","termination":"none"}